{
  "$schema": "http://json-schema.org/draft-07/schema#",
  "type": "object",
  "properties": {
    "id": {
      "type": "number"
    },
    "name": {
      "type": "string"
    },
    "manager": {
      "type": "string"
    },
    "scribe": {
      "type": "string"
    },
    "auditor": {
      "type": "string"
    },
    "departments": {
      "type": "array"
    }
  },
  "required": [
    "id",
    "name",
    "manager",
    "scribe",
    "auditor",
    "departments"
  ]
}